{"schemaVersion":"prismcade-game-v0","id":"prism-grove","title":"Prism Grove","tagline":"Create a character, grow a magical garden, unlock cosmetics.","entrypoint":"games/prism-grove/index.html","runtime":"static-canvas","status":"playable-prototype","avatar":{"required":true,"accountKey":"prismcade.localAccount.v0","preferredView":"low_top_down","preferredSize":64,"supportsInGameCreator":true},"platforms":{"web":true,"macos":true,"ios":true,"htmlShell":true},"localState":{"account":"prismcade.localAccount.v0","save":"prismGrove.save.v0"},"data":{"crops":"games/prism-grove/data/crops.json","mutations":"games/prism-grove/data/mutations.json","cosmetics":"games/prism-grove/data/cosmetics.json","pets":"games/prism-grove/data/pets.json"}}
